{
  "$schema": "http://json-schema.org/draft-07/schema#",
  "type": "array",
  "items": {
    "type": "object",
    "required": ["id", "name", "type", "description", "source_url", "stars", "category", "tags", "tech_stack", "install", "source", "last_synced"],
    "properties": {
      "id": { "type": "string", "pattern": "^[a-z0-9-]+$" },
      "name": { "type": "string" },
      "type": { "type": "string", "enum": ["mcp", "skill", "rule", "prompt", "plugin"] },
      "description": { "type": "string" },
      "source_url": { "type": "string", "format": "uri" },
      "stars": { "type": ["integer", "null"] },
      "pushed_at": { "type": ["string", "null"], "description": "ISO 8601 timestamp of last repo push" },
      "added_at": { "type": "string", "format": "date", "description": "Date when an MCP or Skill entry first joined the catalog" },
      "evaluation": {
        "type": "object",
        "properties": {
          "coding_relevance": { "type": ["integer", "null"], "minimum": 1, "maximum": 5 },
          "doc_completeness": { "type": ["integer", "null"], "minimum": 1, "maximum": 5 },
          "desc_accuracy": { "type": ["integer", "null"], "minimum": 1, "maximum": 5 },
          "writing_quality": { "type": ["integer", "null"], "minimum": 1, "maximum": 5 },
          "specificity": { "type": ["integer", "null"], "minimum": 1, "maximum": 5 },
          "install_clarity": { "type": ["integer", "null"], "minimum": 1, "maximum": 5 },
          "final_score": { "type": ["number", "null"], "minimum": 0, "maximum": 100 },
          "decision": { "type": ["string", "null"], "enum": ["accept", "review", "reject", null] },
          "model_id": { "type": ["string", "null"], "description": "LLM model name or '__cached__'" },
          "rubric_version": { "type": ["string", "null"] },
          "evaluated_at": { "type": ["string", "null"], "description": "ISO 8601 timestamp of evaluation" }
        }
      },
      "category": { "type": "string", "enum": ["frontend", "backend", "fullstack", "mobile", "devops", "database", "testing", "security", "ai-ml", "tooling", "documentation"] },
      "tags": { "type": "array", "items": { "type": "string" } },
      "tech_stack": { "type": "array", "items": { "type": "string" } },
      "install": {
        "type": "object",
        "required": ["method"],
        "properties": {
          "method": { "type": "string", "enum": ["mcp_config", "mcp_config_template", "manual", "git_clone", "download_file", "plugin_marketplace", "npm"] },
          "config": { "type": "object" },
          "placeholder_hints": {
            "type": "object",
            "description": "Map of placeholder name to user-friendly description, e.g. {\"PATH_TO_API_DOT_JSON\": \"TypeDoc generated API JSON file path\"}",
            "additionalProperties": { "type": "string" }
          },
          "target_dir": { "type": "string" },
          "files": { "type": "array", "items": { "type": "string" } },
          "repo": { "type": "string" },
          "branch": { "type": "string", "description": "Optional branch name for git_clone skill installs that extract a skill from a specific branch" },
          "path": { "type": "string", "description": "Optional repository path for git_clone skill installs that extract a single skill directory" }
        }
      },
      "health": {
        "type": "object",
        "description": "Composite health score and signals",
        "properties": {
          "score": { "type": "integer", "minimum": 0, "maximum": 100 },
          "signals": {
            "type": "object",
            "properties": {
              "freshness": { "type": "number", "minimum": 0, "maximum": 100 },
              "popularity": { "type": "number", "minimum": 0, "maximum": 100 },
              "source_trust": { "type": "number", "minimum": 0, "maximum": 100 }
            }
          },
          "freshness_label": { "type": "string", "enum": ["active", "stale", "abandoned"] },
          "last_commit": { "type": ["string", "null"] }
        }
      },
      "source": { "type": "string" },
      "last_synced": { "type": "string", "format": "date" },
      "install_count": {
        "type": "integer",
        "minimum": 0,
        "description": "skills.sh 累计安装次数；仅 skills.sh 数据源会写入，optional"
      },
      "skills_sh_url": {
        "type": "string",
        "format": "uri",
        "description": "skills.sh 上对应 skill 的权威落点 URL；optional"
      },
      "skills_sh_scraped_at": {
        "type": "string",
        "pattern": "^\\d{4}-\\d{2}-\\d{2}T\\d{2}:\\d{2}:\\d{2}(\\.\\d+)?Z$",
        "description": "skills.sh 数据抓取时间，ISO 8601 (e.g. 2026-01-30T04:51:07Z 或 .907Z)；optional"
      },
      "mcp_registry_status": {
        "type": "string",
        "enum": ["active", "inactive", "deprecated"],
        "description": "MCP 官方 registry status；仅 mcp_registry 数据源会写入，optional"
      },
      "mcp_registry_published_at": {
        "type": "string",
        "pattern": "^(\\d{4}-\\d{2}-\\d{2}T\\d{2}:\\d{2}:\\d{2}(\\.\\d+)?Z|)$",
        "description": "MCP registry 收录时间，ISO 8601 或空串（registry 未提供 publishedAt 时占位）；optional"
      },
      "mcp_remotes": {
        "type": "array",
        "description": "MCP server remote endpoints（含 type 与 url）；optional",
        "items": {
          "type": "object",
          "required": ["type", "url"],
          "properties": {
            "type": { "type": "string" },
            "url": { "type": "string", "format": "uri" }
          }
        }
      },
      "mcp_schema_valid": {
        "type": "boolean",
        "description": "Whether a Claude-style MCP config can be derived from catalog install metadata or README evidence；MCP optional"
      },
      "mcp_install_state": {
        "type": "string",
        "enum": ["ready", "needs_config", "manual", "invalid", "unknown"],
        "description": "LLM-classified MCP installability state；MCP optional"
      },
      "mcp_validation_tags": {
        "type": "array",
        "description": "Fixed validation tags explaining MCP config source and blocking reasons；MCP optional",
        "items": {
          "type": "string",
          "enum": [
            "readme_config_found",
            "catalog_config_shape_valid",
            "catalog_config_ready",
            "catalog_config_template",
            "catalog_config_missing",
            "catalog_config_wrong",
            "wrong_config",
            "remote_url",
            "local_command",
            "self_installing_command",
            "placeholder_env",
            "placeholder_path",
            "placeholder_url",
            "placeholder_variable",
            "requires_auth",
            "requires_local_build",
            "requires_local_clone",
            "requires_global_install",
            "requires_project_context",
            "requires_local_app",
            "requires_local_server",
            "requires_extension",
            "requires_daemon",
            "missing_config",
            "command_invalid",
            "args_invalid",
            "env_invalid",
            "no_mcp_config_found",
            "insufficient_evidence",
            "sdk_not_server",
            "not_mcp_server"
          ]
        }
      },
      "mcp_installability_reason": {
        "type": "string",
        "description": "Short reason explaining MCP installability classification；MCP optional"
      },
      "marketplace_url": {
        "type": "string",
        "format": "uri",
        "description": "Plugin marketplace 仓库 URL（如 https://github.com/obra/superpowers-marketplace）；仅 plugin 类型 entry 写入，optional"
      },
      "bundle": {
        "type": "object",
        "description": "Plugin 打包内容统计；plugin 类型 entry 必填，其他类型不出现",
        "properties": {
          "skills_count": { "type": "integer", "minimum": 0 },
          "commands_count": { "type": "integer", "minimum": 0 },
          "agents_count": { "type": "integer", "minimum": 0 },
          "mcp_servers_count": { "type": "integer", "minimum": 0 },
          "skills_namespaces": {
            "type": "array",
            "description": "<plugin-name>:<skill-name> 形式的 skill namespace 列表，供 merge_index.py 软标注",
            "items": { "type": "string" }
          },
          "skill_paths": {
            "type": "array",
            "description": "每个 sub-skill 的 repo 相对 SKILL.md 路径，与 skills_namespaces 同序；供 merge_index.py 为 orphan sub-skill 合成独立 skill 条目的 install 块；optional",
            "items": { "type": "string" }
          },
          "source_repo": {
            "type": "string",
            "description": "plugin 内容所在的 owner/repo（用于合成 orphan sub-skill 的 git_clone install）；optional"
          },
          "source_ref": {
            "type": "string",
            "description": "plugin 内容所在的 git ref/branch；optional"
          },
          "plugin_root": {
            "type": "string",
            "description": "plugin 根目录的 repo 相对路径；download_catalog.py 用于定位 plugin 内 .mcp.json / plugin.json；optional"
          },
          "plugin_json_path": {
            "type": "string",
            "description": "plugin.json 的 repo 相对路径；download_catalog.py 用于提取 inline mcpServers；optional"
          },
          "bundled_skill_ids": {
            "type": "array",
            "description": "与 skills_namespaces 同序的反向映射：每个 namespace 对应的 catalog skill id，或 null（无匹配且无法合成）；merge_index.py post-merge 写入；optional",
            "items": { "type": ["string", "null"] }
          },
          "mcp_server_configs": {
            "type": "object",
            "description": "可安装的 plugin 内 MCP server 配置，key 为 server name，value 为 mcpServers.<name> config；仅包含带 command 或 url 的配置；optional",
            "additionalProperties": { "type": "object" }
          },
          "bundled_mcp_ids": {
            "type": "array",
            "description": "与 mcp_server_names 同序的反向映射：每个 MCP server 对应的 catalog mcp id，或 null（无可用 config）；merge_index.py post-merge 写入；optional",
            "items": { "type": ["string", "null"] }
          }
        }
      },
      "manifest_completeness": {
        "type": "number",
        "minimum": 0.0,
        "maximum": 1.0,
        "description": "上游 plugin.json manifest 完整度：1.0=name+version+description+author 齐全；0.7=缺 description 或 version；0.3=无 manifest；optional"
      },
      "bundled_in": {
        "type": "string",
        "description": "若该 skill/mcp entry 被某 plugin 打包，写入对应的 plugin id；merge_index.py post-merge 标注或合成，optional"
      }
    }
  }
}
